data,decision
"ведением осмотра доказательств на месте, расходы на оплату услуг адвокатов и иных лиц. оказывающих юридическую помощь (представителей), и другие расходы, понесенные лицами, участвующими в деле, в связи с рассмотрением дела в арбитражном суде. В соответствии со ст. 110 АПК РФ судебные расходы, понесенные лицами, участвующими в деле, в пользу которых принят судебный акт взыскиваются арбитражным судом с проигравшей стороны, причем расходы взыскиваются арбитражным судом в разумных пределах. Почтовые расходы в общем размере 114 руб. 00 коп. истцом документально подтверждены, связаны с рассмотрением настоящего дела, в связи с чем, подлежат взысканию с ответчика в полном объеме. В соответствии со ст.ст. 102, 110 АПК РФ госпошлина по иску относится на сторон соответственно удовлетворенным исковым требованиям. С учетом изложенного, на основании ст.ст. 11, 12, 307, 309, 310, 314, 330, 331, 454, 486, 506-524 ГК РФ, руководствуясь ст.ст. 4, 9, , 65, 71, 75, 102, 110, 132, 176, 180, 181 АПК РФ, суд",частично
"тельства встречного предоставления в виде предоставления подарочного сертификата истцу, который по своему усмотрению был использован истцом. Предъявляя к ответчику требование о взыскании задолженности, обусловленных неосмотрительными и неразумными действиями самого истца, истец фактически пытается переложить на ответчика собственные предпринимательские риски, что не предусмотрено действующим законодательством. Таким образом, основания для расторжения договора №0149730659-0001 от 05.12.2023 и взыскания неосновательного обогащения в размере 163 298 руб. с ответчика отсутствуют. С учетом изложенного, исковые требования истца являются недоказанными, необоснованными и удовлетворению не подлежат. В соответствии со ст. 110 АПК РФ расходы по госпошлине относятся на истца, поскольку требования, заявленные в иске, не обоснованы. На основании ст.ст. 11, 12, 309, 310, 450, 452, 453, 457, 487, 506, 1102, 1105 ГК РФ, руководствуясь ст.ст. 64, 65, 104, 110, 123, 156, 167-171, 176, 180, 181 АПК РФ суд",отказано
"счета 0,1% в день от размера невыполненного денежного обязательства, что по расчету истца составляет 159.711руб.57коп. за период с 04.10.2024 по 12.02.2025, и далее по день фактической оплаты . Размер неустойки судом проверен, признан правильным и соответствующим последствиям нарушения обязательства, в связи с чем подлежащим взысканию с ответчика в судебном порядке. Согласно п. 65. Постановления Пленума Верховного Суда РФ № 7 от 24.03.2016г. по смыслу статьи 330 ГК РФ, истец вправе требовать присуждения неустойки по день фактического исполнения обязательства (в частности, фактической уплаты кредитору денежных средств, передачи товара, завершения работ). Таким образом, суд приходит к выводу о начислении неустойки за период с 13.02.2025 по дату фактической оплаты долга. На основании ст. 110 АПК РФ расходы истца по оплате государственной пошлины относятся на ответчика. Руководствуясь ст. ст. 309, 310, 330, 486, 506, 516 ГК РФ, ст. ст. 65,70, 71, 75, 110, 123, 156, 167-171, 176 АПК РФ, суд",частично
"опущение взыскания несоразмерных нарушенному праву сумм, а также исходя из критериев разумности, соразмерности, учитывая сложность спора, суд считает, что сумма расходов на оплату услуг представителя подлежит частичному удовлетворению в размере 16 000 руб., а именно: - 8 000 руб. за составление искового заявления; - 8 000 руб. за участие представителя в судебном заседании. Истец оплатил государственную пошлину в размере 8 161 руб., что подтверждается платежными поручениями от 19.08.2024 № 386 на сумму 7 161 руб. и от 09.09.2024 № 416 на сумму 1 000 руб. 5 Согласно заявленным требованиям (208 072,63 + 22 458,67 = 230531,30) государственная пошлина подлежит уплате в размере 7 611 руб. Поскольку требования истца удовлетворены, то государственную пошлину необходимо взыскать с ответчика в пользу истца в размере 7 611 руб., а 550 руб. подлежат возврату из федерального бюджета (ст.110 АПК РФ). Руководствуясь статьями 110, 167-171, 176 Арбитражного процессуального кодекса Российской Федерации,",частично
"ленный товар не оплачен, задолженность составила 27.368.301руб.20коп. и до настоящего времени им не погашена. Вопреки приведенным доводам ответчика по УПД №9ДТ от 29.09.2023, ответчик подписал спорный УПД без возражений. Обнаружив недопоставку, оно не уведомило незамедлительно об этом истца, не пригласил поставщика для составления акта как то, как сторонами согласовано в 2.4 договора, претензию предъявило лишь в 2024г., по истечении практически года после спорной поставки. 2 Учитывая изложенное, в действиях ответчика усматривается односторонний отказ от исполнения обязательств, что в соответствии со ст. 310 ГК РФ не допускается, следовательно, требование истца о взыскании задолженности в размере 27.368.301руб.20коп. является обоснованным и подлежит удовлетворению в судебном порядке. На основании ст. 110 АПК РФ расходы по оплате государственной пошлины относятся на ответчика. Руководствуясь ст. ст. 309, 310, 486, 506, 516 ГК РФ, ст. ст. 65,70,71, 110, 123, 156, 167- 171, 176 АПК РФ, суд",принято
"ный суд оценивает относимость, допустимость, достоверность каждого доказательства в отдельности, а также достаточность и взаимную связь доказательств в их совокупности. Исследовав и оценив представленные доказательства, исходя из предмета и оснований заявленных исковых требований, с учетом положений ст. 71 Арбитражного процессуального кодекса Российской Федерации, суд приходит к выводу, что требования истца подлежат удовлетворению в части. В соответствии со ст.ст. 102 и 110 АПК РФ госпошлина по иску относится на ответчика. Согласно п. 9 Постановления Пленума ВАС РФ от 20.03.1997 г. № 6 при уменьшении арбитражным судом размера неустойки на основании статьи 333 Гражданского кодекса Российской Федерации расходы истца по государственной пошлине подлежат возмещению ответчиком, исходя из суммы неустойки, которая подлежала бы взысканию без учета ее уменьшения. С учетом изложенного, на основании ст.ст. 307, 309, 310, 330 ГК РФ, руководствуясь ст.ст. 102, 110, 167-171, 176, 180, 181 АПК РФ, суд",отказано
"нных исковых требований. Исковые требования удовлетворены судом частично с учетом снижения неустойки на основании статьи 333 ГК РФ. В соответствии с абзацем 3 пункта 9 постановления Пленума Высшего Арбитражного Суда Российской Федерации от 22.12.2011 № 81 «О некоторых вопросах применения статьи 333 ГК РФ» если размер заявленной неустойки снижен арбитражным судом по правилам статьи 333 ГК РФ на основании заявления ответчика, расходы истца по государственной пошлине не возвращаются в части сниженной суммы из бюджета и подлежат возмещению ответчиком исходя из суммы неустойки, которая подлежала бы взысканию без учета ее снижения. Учитывая, что требования истца были удовлетворены частично, суд взыскивает с истца в пользу ответчика судебные расходы в размере, пропорциональном удовлетворенным требованиям, а именно: 72 000 руб. (79,5% от 90 566 руб. (30 000 руб. + 60 566 руб.)). Руководствуясь статьями 110, 167-171, 176 Арбитражного процессуального кодекса Российской Федерации, арбитражный суд",частично
"вании изложенного, исковые требования подлежат удовлетворению в полном объеме. Согласно статье 168 Арбитражного процессуального кодекса Российской Федерации при принятии решения арбитражным судом суд решает вопрос о распределении судебных расходов. В соответствии со статьей 101 Арбитражного процессуального кодекса Российской Федерации судебные расходы состоят из государственной пошлины и судебных издержек. Согласно статье 110 Арбитражного процессуального кодекса Российской Федерации, судебные расходы, понесенные лицами, участвующими в деле, в пользу которых принят судебный акт, взыскиваются арбитражным судом со стороны. При подаче иска Истец оплатил государственную пошлину в сумме 2000,00 руб. платежным поручением №71490 от 28.08.2024г. Государственная пошлина от уточненных исковых требований составляет 2000,00 руб. и подлежит взысканию с ответчика в пользу истца. Руководствуясь статьями п.4 части 1 статьи 148, 110, 167-171 Арбитражного процессуального кодекса Российской Федерации, суд",отказано
"дом рассмотрено и отклонено. В соответствии с частью 1 статьи 110 АПК РФ судебные расходы, понесенные лицами, участвующими в деле, в пользу которых принят судебный акт, взыскиваются арбитражным судом со стороны. В рассматриваемом случае судебный акт принят не в пользу ОАО «Рыбинская городская электросеть», в связи с чем понесенные им судебные расходы возмещению не подлежат. На основании статьи 110 АПК РФ судебные расходы по уплате государственной пошлины относятся на ОАО «Рыбинская городская электросеть». Излишне уплаченная государственная пошлина подлежит возврату истцу из бюджета. Сторонам разъясняется, что решение, выполненное в форме электронного документа, направляется лицам, участвующим в деле, посредством его размещения на официальном сайте арбитражного суда в информационно-телекоммуникационной сети «Интернет» в режиме ограниченного доступа (часть 1 статьи 177 АПК РФ). Руководствуясь статьями 110, 167-170 Арбитражного процессуального кодекса Российской Федерации, арбитражный суд",отказано
"ваний. Ответчик в судебное заседание не явился, письменного отзыва в нарушение положений статьи 131 АПК РФ в материалы дела не представил. Учитывая, что требования Истца обоснованы, документально подтверждены, исковые требования подлежат удовлетворению в полном объеме. В соответствии с частью 1 статьи 110 Арбитражного процессуального кодекса Российской Федерации судебные расходы, понесенные лицами, участвующими в деле, в пользу которых принят судебный акт, взыскиваются арбитражным судом со стороны. Согласно статье 101 Арбитражного процессуального кодекса Российской Федерации судебные расходы состоят из государственной пошлины и судебных издержек, связанных с рассмотрением дела арбитражным судом. В связи с удовлетворением исковых требований, с ответчика в пользу истца подлежат взысканию судебные расходы по оплате государственной пошлины в размере 46505,00 руб., оплаченные Истцом по платежному поручению №75420 от 03.10.2024г. Руководствуясь 101-106,110, 167-171, 176, 180, 181 АПК РФ, суд",частично
" взносов, пеней, штрафов, процентов, подлежащих уплате в соответствии с законодательством о налогах и сборах. Таким образом, недоимка, задолженность по налогам, страховым взносам и штрафам, на наличие которой Общество ссылается и просит признать ее безнадежной ко взысканию, отсутствует. Поскольку спорная задолженность отсутствует, следовательно ее невозможно признать безнадежной ко взысканию. Аналогичная позиция изложена в постановлении Арбитражного суда Северо- Кавказского округа от 31.01.2024 по делу № А15-7547/2022. Исследовав обстоятельства дела и оценив в соответствии со статьей 71 АПК РФ представленные сторонами доказательства, учитывая перечисленные выше нормы права, а также обстоятельства данного дела и представленные по нему доказательства, арбитражный суд приходит к выводу о том, что заявленные истцом исковые требования 10 удовлетворению не подлежат в полном объеме. Руководствуясь статьями 167-170, 176 Арбитражного процессуального кодекса Российской Федерации, арбитражный суд",частично
"соответствуют действительности. Доказательств, свидетельствующих об отсутствии вины ответчика, в материалы дела не представлено. При изложенных обстоятельствах, учитывая, что ООО «Алтай» не представлены доказательства принятия мер для надлежащего исполнения обязательств по Договору, а также того, что надлежащее исполнение оказалось невозможным вследствие непреодолимой силы, суд пришел к выводу о наличии оснований для взыскания штрафа в размере 624 000 руб. Представленный истцом расчет штрафа документально не опровергнут, судом проверен и признан верным. При таких обстоятельствах суд признает исковые требования ООО «ТК «Парк» обоснованными и подлежащими удовлетворению в полном объеме. Истцом при обращении в арбитражный суд была уплачена государственная пошлина в размере 15 480 руб., расходы по уплате которой на основании части 1 статьи 110 АПК РФ суд относит на ответчика. Руководствуясь статьями 110, 167-171, 176 Арбитражного процессуального кодекса Российской Федерации, арбитражный суд",принято
"7 Налогового кодекса Российской Федерации от уплаты государственной пошлины по делам, рассматриваемым арбитражными судами, освобождаются государственные органы, органы местного самоуправления, выступающие в качестве истцов или ответчиков. Следовательно, Администрация как орган местного самоуправления освобождена от уплаты государственной пошлины. 11 В пункте постановления Пленума Высшего Арбитражного Суда Российской Федерации от 11.07.2014 N 46 ""О применении законодательства о государственной пошлине при рассмотрении дел в арбитражных судах"" разъяснено, что согласно подпункту 2 пункта 2 статьи 333.17 НК РФ ответчики признаются плательщиками государственной пошлины в случае, если решение суда принято не в их пользу и истец освобожден от ее уплаты. При таких обстоятельствах государственная пошлина в размере 18 468 руб. подлежит взысканию с ответчика в доход федерального бюджета Руководствуясь статьями 167-171, 176 Арбитражного процессуального кодекса Российской Федерации, арбитражный суд",принято
"ью соразмерного удовлетворения требований кредиторов. В силу специфики своей профессиональной деятельности арбитражный управляющий обязан знать требования нормативных актов, регулирующих такую деятельность, обязан предпринять все зависящие от него меры по соблюдению требований нормативных актов и предвидеть возможность наступления последствий при ненадлежащем исполнении требований законодательства. В рассматриваемом случае, суд не усматривает оснований для применения положений статьи 2.9 КоАП РФ, поскольку данные обстоятельства свидетельствуют о пренебрежительном отношении арбитражного управляющего к исполнению своих публично-правовых обязанностей. Вместе с тем, учитывая устранение выявленного нарушения и фактические обстоятельства дела в качестве меры ответственности суд полагает возможным применить предупреждение, что соответствует минимальной санкции ч.3 ст. 14.13 КоАП РФ. Руководствуясь статьями 167-170, 206 Арбитражного процессуального кодекса Российской Федерации, арбитражный суд",в пользу ответчика
