data,decision
"млению прав одной из его сторон (пункт 4 раздела II Обзора судебной практики Верховного Суда Российской Федерации № 4, утв. Президиумом Верховного Суда Российской Федерации 23.12.2015). На основании статьи 110 Арбитражного процессуального кодекса Российской Федерации, расходы по уплате государственной пошлины относятся на стороны пропорционально удовлетворенным требованиям. Злоупотребления со стороны истца, как указывает ответчик, то есть оснований, которые в силу части 2 статьи 111 Арбитражного процессуального кодекса Российской Федерации позволяют возложить все судебные расходы на лицо, злоупотребляющее своими процессуальными правами или не выполняющее свои процессуальные обязанности, судом не установлено. Само по себе изменение истцом размера исковых требований не является безусловным основанием для признания его действий злоупотреблением правом. Руководствуясь статьями 106, 110, 167-170 Арбитражного процессуального кодекса Российской Федерации, Арбитражный суд Архангельской области",частично
"правовых обязанностей, к формальным требованиям публичного права, связанным со строительством объекта капитального строительства. Материалы дела не содержат доказательств того, что фактические обстоятельства дела могут свидетельствовать об исключительности ситуации, позволяющей применить статью 2.9 Кодекса Российской Федерации об административных правонарушениях. В свою очередь, административное правонарушение, предусмотренное статьей 19.5 Кодекса Российской Федерации об административных правонарушениях, отнесено в соответствии с частью 2 статьи 4.1.1 Кодекса Российской Федерации об административных правонарушениях к числу административных правонарушений, при совершении которых не допускается замена наказания в виде административного штрафа предупреждением. Заявление о привлечении к административной ответственности государственной пошлиной не облагается. Руководствуясь статьями 167-170, 176, 206 Арбитражного процессуального кодекса Российской Федерации, арбитражный суд А54-1098/2025 11",отказано
"ются в части сниженной суммы из бюджета и подлежат А43-34385/2024 6 возмещению ответчиком исходя из суммы неустойки, которая подлежала бы взысканию без учета ее снижения. Определением от 28.10.2024 суд отказал истцу в принятии обеспечительных мер. В порядке статьи 110 Арбитражного процессуального кодекса Российской Федерации расходы по государственной пошлине за рассмотрение заявления о принятии обеспечительных мер подлежат отнесению на истца. Настоящее решение выполнено в форме электронного документа, подписано усиленной квалифицированной электронной подписью судьи и в соответствии с частью 1 статьи 177 Арбитражного процессуального кодекса Российской Федерации будет направлено лицам, участвующим в деле, посредством его размещения на официальном сайте арбитражного суда в сети «Интернет» в режиме ограниченного доступа не позднее следующего дня после дня его принятия. Руководствуясь статьями 110, 167 - 171, 176, 180, 181, 319 Арбитражного процессуального кодекса Российской Федерации, суд",принято
"атериалы дела не представлено, суд оснований для снижения пени не находит. Суд произвел самостоятельный расчет пени исходя из суммы задолженности, исчисленной по льготному тарифу. С учетом изложенного, суд взыскивает с ответчика в пользу истца 503,95 руб. пени за период с 10.02.2024 по 24.02.2025 (на день вынесения решения). Суд также считает подлежащими удовлетворению требования истца о взыскании с ответчика пени по день фактической оплаты долга с 25.02.2025. В удовлетворении остальной части требований суд отказывает. В соответствии со статьей 110 АПК РФ судебные расходы, понесенные лицами, участвующими в деле, в пользу которых принят судебный акт, взыскиваются арбитражным судом со стороны. Излишне уплаченная при подаче иска государственная пошлина подлежит возврату истцу на основании статьи 104 АПК РФ, статьи 333.40 Налогового кодекса Российской Федерации. Руководствуясь статьями 167-171, 176 Арбитражного процессуального кодекса Российской Федерации, Арбитражный суд Тюменской области",частично
"ния по отношению к ООО «АСК» (ответчику) в размере 5 000 рублей, также соответствующих процентов». В качестве документа, удостоверяющего уступленное право требования в договоре обозначена «квитанция об оплате 5 000 рублей». Таким образом, предмет договора и основание возникновения права требования сформулированы не четко, с использованием общих фраз, без конкретизации, что, по правилам статьи 431 ГК РФ затрудняет определить содержание этого договора и действительную волю сторон при его заключении. При изложенных обстоятельствах суд не находит оснований для удовлетворения иска, как в части требования основного долга, так и процентов за пользование чужими денежными средствами. В соответствии со статьей 110 АПК РФ судебные расходы ответчика по оплате судебной экспертизы, а также государственная пошлина по иску относится на истца. В связи с изложенным, руководствуясь статьями 110, 112, 167 – 169 Арбитражного процессуального кодекса Российской Федерации, Арбитражный суд Республики Татарстан",отказано
"и совершенного правонарушения и обеспечивает достижение целей административного наказания, предусмотренных частью 1 статьи 3.1 КоАП РФ. Поскольку в ходе проверки арест и изъятие вещей не осуществлялось, основания для разрешения в настоящем деле вопросов, указанных в части 3 статьи 29.10 КоАП РФ, отсутствуют. В соответствии с пунктом 1.1 статьи 29.10 КоАП РФ и пунктом 15 Постановления Пленума Высшего Арбитражного Суда Российской Федерации от А26-10751/2024 10 02.06.2004 № 10 в настоящем решении подлежит указанию информация о получателе штрафа, необходимая для заполнения расчетных документов. Руководствуясь статьями 167-170, 206, 229 Арбитражного процессуального кодекса Российской Федерации, пунктом 37 Постановления Пленума Верховного Суда Российской Федерации от 18.04.2017 № 10 «О некоторых вопросах применения судами положений Гражданского процессуального кодекса Российской Федерации и Арбитражного процессуального кодекса Российской Федерации об упрощенном производстве», арбитражный суд",принято
"государственную пошлину, предусмотренную статьями 1000071_6938759 9 333.19 и 333.21 НК РФ, наравне с иными участниками процесса. Например, по спору о взыскании переплаты за услуги по теплоснабжению занимаемых помещений инспекция Федеральной налоговой службы выступает в качестве участника гражданских правоотношений и хозяйствующего субъекта, а потому уплачивает государственную пошлину на общих основаниях. Из спорного контракта (п.1.1, п.1.5) усматривается, что он заключен с целью капитального ремонта офиса семейного врача. Финансирование ремонта осуществляется за счет субсидий из бюджета. Таким образом, контракт был заключен истцом не для собственных нужд, и настоящий спор связан с выполнением истцом отдельных функций государственного органа. При изложенных обстоятельствах, с ответчика в доход федерального бюджета подлежит взысканию государственная пошлина в размере 7 251,63 руб. Руководствуясь статьями 110, 167 - 170, 227 - 229 Арбитражного процессуального кодекса Российской Федерации,",частично
"ю на ответчика. Расходы на фиксацию правонарушения признаны судом чрезмерными, поскольку выражались в осмотре сайта в информационно-телекоммуникационной сети Интернет и не требовали специальных познаний и затрат. Таким образом, в требовании о взыскании расходов на фиксацию правонарушения суд отказывает. При изготовлении резолютивной части решения судом была допущена опечатка при указании суммы взысканных почтовых расходов, а именно ошибочно указана сумма «142,50руб.,», тогда как следовало указать «142руб.,». В соответствии с частью 3 статьи 179 Арбитражного процессуального кодекса Российской Федерации арбитражный суд, принявший решение, по своей инициативе вправе исправить допущенные описки без изменения его содержания. Таким образом, суд считает возможным исправить допущенную опечатку и читать сумму почтовых расходов, взысканной с ответчика, «в сумме 142руб.». Руководствуясь статьями 110,112,167-170,176-180,181 Арбитражного процессуального кодекса Российской Федерации, арбитражный суд",отказано
"тся рассмотрение дела по существу (ст. 112 АПК РФ). Учитывая, что почтовые расходы связаны с рассматриваемым спором, подтверждены надлежащими доказательствами, с учётом результата рассмотрения дела подлежат отнесению на ответчика В соответствии с ч.1 ст.110 Арбитражного процессуального кодекса Российской Федерации судебные расходы, понесенные лицом, участвующим в деле, в пользу которого принят судебный акт, взыскиваются со стороны. Поскольку при предъявлении искового заявления истец был освобожден от уплаты государственной пошлины на основании пп. 1 п. 1 ст. 333.37 Налогового кодекса Российской Федерации, государственная пошлина подлежит взысканию с ответчика непосредственно в доход федерального 1245703104_15944524 5 бюджета на основании ст.110 Арбитражного процессуального кодекса Российской Федерации. На основании 330, 606, 614 Гражданского кодекса Российской Федерации, руководствуясь статьями 110, 167-171, 229 Арбитражного процессуального кодекса Российской Федерации, арбитражный суд",частично
"ия обязательств. Размер договорной неустойки, определенный сторонами (0,1 % не перечисленных сумм за каждый день просрочки), не является завышенным и не выходит за рамки обычной деловой практики по данной категории дел, требований разумности и справедливости. Иного ответчиком в нарушение статьи 65 АПК РФ не доказано. Вопреки доводам ответчика, конкурсного кредитора ответчика, с учетом конкретных обстоятельств дела, а именно разумной ставки неустойки (0,1% суммы долга в день), длительности периода просрочки, оснований для снижения неустойки в связи с ее несоразмерностью в порядке статьи 333 ГК РФ не имеется. Само по себе нахождение ответчика в процедуре банкротства достаточным основанием для снижения неустойки не является. Государственная пошлина подлежит взысканию с ответчика в доход федерального бюджета (ст. 110 Арбитражного процессуального кодекса Российской Федерации). Руководствуясь ст.110, 167-170, 171, 176 Арбитражного процессуального кодекса Российской Федерации, арбитражный суд",принято
"редств с расходами ответчика при управлении спорными МКД суд приходит к выводу о наличии отрицательного сальдо в размере 4695486 руб. 12 коп., что указывает на отсутствие неосновательного обогащения на стороне ответчика и отказ в иске по данному основанию. Иные доводы ответчика, как то отсутствие полномочий на предъявление иска и пропуск срока исковой давности суд отклоняет, поскольку право на предъявление иска управляющей компанией от имени собственников следует из закона; срок исковой давности также не пропущен, поскольку он начинает течь не ранее даты, когда истец приступил к управлению многоквартирными домами. Судебные расходы по делу относятся на истца в порядке ст. 110 АПК РФ. 100792_15942298 7 Поскольку при подаче иска истцу была предоставлена отсрочка по уплате государственной пошлины, то 103466 руб. 00 коп. подлежат взысканию с истца в доход федерального бюджета. Руководствуясь ст.110, 167-170, 171, 176 Арбитражного процессуального кодекса Российской Федерации, арбитражный суд",отказано
"йствий, а общество не представило доказательств нарушения действием должностных лиц его прав и законных интересов, то суд отказывает в удовлетворении заявленных требований общества в полном объеме. Дополнительно суд указывает заявителю на то, что взыскатель не лишен права повторно предъявить исполнительный лист ко взысканию в пределах трех лет со дня возвращения исполнительного листа взыскателю, если не истек трехлетний срок на предъявление исполнительного документа к исполнению, исчисляемый с даты получения почтой взыскателем постановления об окончании исполнительного производства. Вопрос о распределении судебных расходов не рассматривался, поскольку в соответствии с частью 2 статьи 329 Арбитражного процессуального кодекса Российской Федерации заявление об оспаривании решений и действий (бездействия) судебного пристава-исполнителя государственной пошлиной не облагается. Руководствуясь статьями 167-170, 176, 201 Арбитражного процессуального кодекса Российской Федерации, арбитражный суд",отказано
"значейства, банками и иными кредитными организациями, должностными лицами и гражданами (часть 1 статьи 7, статья 8, пункт 16 части 1 статьи 64 и часть 2 статьи 70 Закона об исполнительном производстве). Учитывая, что денежное обязательство на момент вынесения решения по настоящему делу не исполнено, суд считает подлежащим удовлетворению требование истца о взыскании с 18.01.2025 процентов за пользование чужими денежными средствами на сумму задолженности, составляющую на день вынесения решения 115489 руб., за каждый день просрочки до дня фактической уплаты денежных средств, исходя из ключевой ставки (ставки рефинансирования) Банка России, действующей в соответствующие периоды. Согласно части 2 статьи 168 АПК РФ при принятии решения арбитражный суд решает вопрос о распределении судебных расходов. В соответствии со статьей 110 АПК РФ расходы по государственной пошлине относятся на ответчика. Руководствуясь статьями 110, 167-171 Арбитражного процессуального кодекса Российской Федерации, суд",принято
"0 000 руб. 00 коп. Истцом в доход федерального бюджета уплачена государственная пошлина в размере 35 000 руб. 00 коп., что подтверждается платежным поручением №168 от 11.11.2024г. На основании изложенного, учитывая, что суд пришел к выводу о частичном удовлетворении исковых требований. Судебные расходы по уплате государственной пошлины за рассмотрение искового заявления подлежат распределению в порядке статьи 110 Арбитражного процессуального кодекса Российской Федерации, в связи с чем с ответчика в пользу истца подлежат взысканию судебные расходы по оплате государственной пошлины в размере 33 333 руб. 00 коп. пропорционально размеру удовлетворенных исковых требований, а недоплаченная при подаче искового заявления государственная пошлина в размере 1 554 руб. 00 коп. подлежит взысканию с истца в доход федерального бюджета. 18_17153423 5 Руководствуясь статьями 9, 41, 65, 70, 71, 104 110, 112, 167-170, 176, 226-229 Арбитражного процессуального кодекса Российской Федерации, арбитражный суд",частично
